<?xml version="1.0" encoding="UTF-8" ?>
<gather_drops xmlns="http://angelis.com/gather_drops" xmlns:xsi="http://www.w3.org/2001/XMLSchema-instance" xsi:schemaLocation="http://angelis.com/gather_drops ../../../../schema/gather_drops.xsd">
    <gather_drop gather_id="1" name="Verdra Plant">
        <drop chance="HIGH" max_amount="4" min_amount="2" item_id="1001"/>
        <drop chance="RARE" max_amount="3" min_amount="1" item_id="209"/>
        <drop chance="RARE" max_amount="3" min_amount="1" item_id="210"/>
        <drop chance="RARE" max_amount="3" min_amount="1" item_id="211"/>
        <drop chance="RARE" max_amount="3" min_amount="1" item_id="213"/>
        <drop chance="RARE" max_amount="3" min_amount="1" item_id="215"/>
        <drop chance="VERY_LOW" max_amount="3" min_amount="1" item_id="1071"/>
        <drop chance="LOW" max_amount="3" min_amount="1" item_id="1051"/>
    </gather_drop>
</gather_drops>